Extracted contents:
header:          00 ff ff ff ff ff ff 00
serial number:   4c 83 4a 34 00 00 00 00 00 17
version:         01 04
basic params:    80 22 13 78 0a
chroma info:     71 05 93 55 57 8f 29 20 50 54
established:     00 00 00
standard:        01 01 01 01 01 01 01 01 01 01 01 01 01 01 01 01
descriptor 1:    1b 1b 56 62 50 00 16 30 30 20 25 00 58 c2 10 00 00 19
descriptor 2:    00 00 00 0f 00 00 00 00 00 00 00 00 00 1e b4 02 74 00
descriptor 3:    00 00 00 fe 00 53 41 4d 53 55 4e 47 0a 20 20 20 20 20
descriptor 4:    00 00 00 fe 00 31 35 36 41 54 33 31 2d 50 30 31 0a 20
extensions:      00
checksum:        31

Manufacturer: SDC Model 344a Serial Number 0
Made week 0 of 2013
EDID version: 1.4
Digital display
Color depth is undefined
Digital interface is not defined
Maximum image size: 34 cm x 19 cm
Gamma: 2.20
Supported color formats: RGB 4:4:4, YCrCb 4:2:2
First detailed timing is preferred timing
Chroma Info:
Red X: 0.575195 Y: 0.334961
Green X: 0.339844 Y: 0.559570
Blue X: 0.160156 Y: 0.125000
White X: 0.313477 Y: 0.329102
Established timings supported:
Standard timings supported:
Detailed mode: Clock 69.390 MHz, 344 mm x 194 mm
               1366 1414 1446 1464 hborder 0
                768  770  775  790 vborder 0
               -hsync -vsync 
Manufacturer-specified data, tag 15
ASCII string: SAMSUNG
ASCII string: 156AT31
Checksum: 0x31 (valid)
EDID block does NOT conform to EDID 1.3!
	Missing name descriptor
	Missing monitor ranges
	Detailed block string not properly terminated
